Committee Id,Committee Name,Committee Type,Committee SubType,Candidate Office,Candidate Office Group,Filing Date,Organization Filing Date,Treasurer First Name,Treasurer Last Name,Treasurer Mailing Address,Treasurer Work Phone,Treasurer Fax,Candidate First Name,Candidate Last Name,Candidate Maling Address,Candidate Work Phone,Candidate Residence Phone,Candidate Fax,Candidate Email,Active Election,Measure
14006,Friends of Rich Cunningham,CC,,"City of Eugene, Ward 6",City Councilor,11/04/2009,11/04/2009,Marissa,Morris,1773 Berwin Lane Eugene OR 97404,,,Richard,Cunningham Jr,5185 Trevon Street Eugene OR 97402,,,,richc414@aol.com,2010 Primary Election,
14268,Friends of Pat Farr,CC,,"City of Eugene, Ward 6",City Councilor,03/11/2010,02/25/2010,Carol,Russell,89358 Cranberry Lane Bandon OR 97411,,(800)967-7380,Patrick,Farr,1929 Praslin St Eugene OR 97402,(541)461-4091,,,farrout72@gmail.com,2010 Primary Election,
8085,Solomon for City Council,CC,,"City of Eugene, Ward 6",City Councilor,06/01/2011,03/07/2002,Jennifer,Solomon,2005 Lemuria St Eugene OR 97402,,(541)461-4600,Jennifer,Solomon,2005 Lemuria St Eugene OR 97402,(541)461-3518,,(541)461-4600,jennifer.l.solomon@ci.eugene.or.us,2006 General Election,
14043,Friends of Rich Gaston,CC,,"City of Eugene, Ward 6",City Councilor,07/28/2015,12/11/2009,Richard,Gaston,2281 Wisconsin Street Eugene OR 97402,,,Richard,Gaston,2281 Wisconsin Street Eugene OR 97402,(541)607-9355,,,GASTONforcitycouncil@gmail.com,2010 Primary Election,
16168,Friends of Greg Evans,CC,,"City of Eugene, Ward 6",City Councilor,10/14/2021,02/08/2013,Mary,Walston,245 Sunnyside Drive Eugene OR 97405,,,Greg,Evans,5147 Trevon Street Eugene OR 97402,(541)463-5340,,(541)463-3997,evansg@lanecc.edu,2013 May Election,
22001,Friends of Greg Evans,CC,,"City of Eugene, Ward 6",City Councilor,03/09/2022,03/09/2022,Mary,Walston,245 Sunnyside Drive Eugene OR 97404,,,Greg,Evans,5147 Trevon Street Eugene OR 97402,(541)463-5340,,(541)463-3997,gregevans0691@gmail.com,2022 Primary Election,
